{
  "resourceType": "Bundle",
  "id": "bundle-fixture-synthetic-001",
  "type": "collection",
  "timestamp": "2025-03-10T12:00:00Z",
  "entry": [
    {"fullUrl":"urn:uuid:patient-fixture","resource":{"resourceType":"Patient","id":"patient-fixture","meta":{"tag":[{"system":"https://rnds.saude.gov.br/tags/data-origin","code":"SYNTHETIC"}]},"active":true,"gender":"other","birthDate":"1990-01-15"}},
    {"fullUrl":"urn:uuid:org-fixture","resource":{"resourceType":"Organization","id":"org-fixture","meta":{"tag":[{"system":"https://rnds.saude.gov.br/tags/data-origin","code":"SYNTHETIC"}]},"active":true}},
    {"fullUrl":"urn:uuid:encounter-fixture","resource":{"resourceType":"Encounter","id":"encounter-fixture","meta":{"tag":[{"system":"https://rnds.saude.gov.br/tags/data-origin","code":"SYNTHETIC"},{"system":"https://rnds.saude.gov.br/model","code":"RAC"}]},"status":"finished","class":{"code":"AMB"},"subject":{"reference":"Patient/patient-fixture"},"serviceProvider":{"reference":"Organization/org-fixture"},"period":{"start":"2025-03-10T09:00:00Z","end":"2025-03-10T09:35:00Z"}}},
    {"fullUrl":"urn:uuid:condition-fixture","resource":{"resourceType":"Condition","id":"condition-fixture","meta":{"tag":[{"system":"https://rnds.saude.gov.br/tags/data-origin","code":"SYNTHETIC"},{"system":"https://rnds.saude.gov.br/model","code":"RAC"}]},"subject":{"reference":"Patient/patient-fixture"},"encounter":{"reference":"Encounter/encounter-fixture"},"recordedDate":"2025-03-10T09:20:00Z"}},
    {"fullUrl":"urn:uuid:observation-fixture","resource":{"resourceType":"Observation","id":"observation-fixture","meta":{"tag":[{"system":"https://rnds.saude.gov.br/tags/data-origin","code":"SYNTHETIC"},{"system":"https://rnds.saude.gov.br/model","code":"REL"}]},"status":"final","code":{"coding":[{"system":"http://loinc.org","code":"718-7"}]},"subject":{"reference":"Patient/patient-fixture"},"encounter":{"reference":"Encounter/encounter-fixture"},"effectiveDateTime":"2025-03-10T09:25:00Z","issued":"2025-03-10T11:00:00Z","valueQuantity":{"value":13.4,"unit":"g/dL"}}},
    {"fullUrl":"urn:uuid:immunization-fixture","resource":{"resourceType":"Immunization","id":"immunization-fixture","meta":{"tag":[{"system":"https://rnds.saude.gov.br/tags/data-origin","code":"SYNTHETIC"},{"system":"https://rnds.saude.gov.br/model","code":"RIA"}]},"status":"completed","vaccineCode":{"coding":[{"system":"http://hl7.org/fhir/sid/cvx","code":"140"}]},"patient":{"reference":"Patient/patient-fixture"},"encounter":{"reference":"Encounter/encounter-fixture"},"occurrenceDateTime":"2025-03-10T09:30:00Z"}},
    {"fullUrl":"urn:uuid:request-fixture","resource":{"resourceType":"ServiceRequest","id":"request-fixture","meta":{"tag":[{"system":"https://rnds.saude.gov.br/tags/data-origin","code":"SYNTHETIC"},{"system":"https://rnds.saude.gov.br/model","code":"RIRA"}]},"status":"completed","intent":"order","subject":{"reference":"Patient/patient-fixture"},"encounter":{"reference":"Encounter/encounter-fixture"},"authoredOn":"2025-03-10T09:32:00Z","requester":{"reference":"Organization/org-fixture"},"reasonReference":[{"reference":"Condition/condition-fixture"}],"supportingInfo":[{"reference":"Observation/observation-fixture"}]}},
    {"fullUrl":"urn:uuid:medication-request-fixture","resource":{"resourceType":"MedicationRequest","id":"medication-request-fixture","meta":{"tag":[{"system":"https://rnds.saude.gov.br/tags/data-origin","code":"SYNTHETIC"},{"system":"https://rnds.saude.gov.br/model","code":"RPM"}]},"status":"active","intent":"order","medicationCodeableConcept":{"coding":[{"system":"https://example.org/CodeSystem/synthetic-medication","code":"MED-001"}]},"subject":{"reference":"Patient/patient-fixture"},"encounter":{"reference":"Encounter/encounter-fixture"},"authoredOn":"2025-03-10T09:32:00Z","requester":{"reference":"Organization/org-fixture"},"reasonReference":[{"reference":"Condition/condition-fixture"}],"dosageInstruction":[{"route":{"coding":[{"system":"https://example.org/CodeSystem/synthetic-route","code":"PO"}]},"doseAndRate":[{"doseQuantity":{"value":1,"unit":"TAB","system":"http://unitsofmeasure.org","code":"TAB"}}],"timing":{"repeat":{"frequency":1,"period":1,"periodUnit":"d"}}}],"dispenseRequest":{"validityPeriod":{"start":"2025-03-10T09:32:00Z","end":"2025-04-09T09:32:00Z"},"numberOfRepeatsAllowed":0,"quantity":{"value":30,"unit":"TAB","system":"http://unitsofmeasure.org","code":"TAB"},"expectedSupplyDuration":{"value":30,"unit":"d","system":"http://unitsofmeasure.org","code":"d"}}}}
    ,{"fullUrl":"urn:uuid:provenance-fixture","resource":{"resourceType":"Provenance","id":"provenance-fixture","meta":{"tag":[{"system":"https://rnds.saude.gov.br/tags/data-origin","code":"SYNTHETIC"},{"system":"https://rnds.saude.gov.br/model","code":"PROVENANCE"}]},"target":[{"reference":"Patient/patient-fixture"},{"reference":"MedicationRequest/medication-request-fixture"}],"recorded":"2025-03-10T12:00:00Z","agent":[{"who":{"reference":"Organization/org-fixture"}}]}}
  ]
}
